{
  "$defs": {
    "SimulationActor": {
      "additionalProperties": false,
      "description": "Caller-owned actor identity used on emitted lifecycle events.",
      "properties": {
        "id": {
          "maxLength": 128,
          "minLength": 1,
          "pattern": "^[A-Za-z0-9][A-Za-z0-9._:-]*$",
          "title": "Id",
          "type": "string"
        }
      },
      "required": [
        "id"
      ],
      "title": "SimulationActor",
      "type": "object"
    },
    "SimulationEventIdentityDocument": {
      "additionalProperties": false,
      "description": "Caller-owned CloudEvents identity for one lifecycle fact.",
      "properties": {
        "id": {
          "minLength": 1,
          "pattern": "^[^\\x00-\\x1F\\x7F-\\x9F]+$",
          "title": "Id",
          "type": "string"
        },
        "time": {
          "format": "date-time",
          "pattern": "^[0-9]{4}-(?:0[1-9]|1[0-2])-(?:0[1-9]|[12][0-9]|3[01])T(?:[01][0-9]|2[0-3]):[0-5][0-9]:[0-5][0-9](?:\\.[0-9]+)?(?:Z|[+-](?:[01][0-9]|2[0-3]):[0-5][0-9])$",
          "title": "Time",
          "type": "string"
        }
      },
      "required": [
        "id",
        "time"
      ],
      "title": "SimulationEventIdentityDocument",
      "type": "object"
    }
  },
  "$id": "https://researchos.dev/schemas/simulation-request/v0alpha1.schema.json",
  "$schema": "https://json-schema.org/draft/2020-12/schema",
  "additionalProperties": false,
  "description": "Versioned external request for one deterministic simulated Run.",
  "properties": {
    "actor": {
      "$ref": "#/$defs/SimulationActor"
    },
    "apiVersion": {
      "const": "researchos.dev/v0alpha1",
      "title": "Apiversion",
      "type": "string"
    },
    "attemptId": {
      "maxLength": 128,
      "minLength": 1,
      "pattern": "^[A-Za-z0-9][A-Za-z0-9._:-]*$",
      "title": "Attemptid",
      "type": "string"
    },
    "events": {
      "additionalProperties": {
        "$ref": "#/$defs/SimulationEventIdentityDocument"
      },
      "maxProperties": 11,
      "propertyNames": {
        "enum": [
          "run.queued",
          "run.started",
          "run.completed",
          "run.failed",
          "run.cancelled",
          "attempt.queued",
          "attempt.started",
          "attempt.succeeded",
          "attempt.failed",
          "attempt.unknown",
          "attempt.cancelled"
        ]
      },
      "title": "Events",
      "type": "object"
    },
    "kind": {
      "const": "SimulationRequest",
      "title": "Kind",
      "type": "string"
    },
    "runId": {
      "maxLength": 128,
      "minLength": 1,
      "pattern": "^[A-Za-z0-9][A-Za-z0-9._:-]*$",
      "title": "Runid",
      "type": "string"
    },
    "source": {
      "maxLength": 2048,
      "minLength": 1,
      "pattern": "^(?:[A-Za-z][A-Za-z0-9+.-]*:(?://(?:(?:[A-Za-z0-9._~-]|%[0-9A-Fa-f]{2}|[!$&'()*+,;=]|:)*@)?(?:\\[(?:(?:(?:[0-9A-Fa-f]{1,4}:){6}(?:[0-9A-Fa-f]{1,4}:[0-9A-Fa-f]{1,4}|(?:(?:[0-9]|[1-9][0-9]|1[0-9]{2}|2[0-4][0-9]|25[0-5])\\.){3}(?:[0-9]|[1-9][0-9]|1[0-9]{2}|2[0-4][0-9]|25[0-5]))|::(?:[0-9A-Fa-f]{1,4}:){5}(?:[0-9A-Fa-f]{1,4}:[0-9A-Fa-f]{1,4}|(?:(?:[0-9]|[1-9][0-9]|1[0-9]{2}|2[0-4][0-9]|25[0-5])\\.){3}(?:[0-9]|[1-9][0-9]|1[0-9]{2}|2[0-4][0-9]|25[0-5]))|(?:[0-9A-Fa-f]{1,4})?::(?:[0-9A-Fa-f]{1,4}:){4}(?:[0-9A-Fa-f]{1,4}:[0-9A-Fa-f]{1,4}|(?:(?:[0-9]|[1-9][0-9]|1[0-9]{2}|2[0-4][0-9]|25[0-5])\\.){3}(?:[0-9]|[1-9][0-9]|1[0-9]{2}|2[0-4][0-9]|25[0-5]))|(?:[0-9A-Fa-f]{1,4}(?::[0-9A-Fa-f]{1,4}){0,1})?::(?:[0-9A-Fa-f]{1,4}:){3}(?:[0-9A-Fa-f]{1,4}:[0-9A-Fa-f]{1,4}|(?:(?:[0-9]|[1-9][0-9]|1[0-9]{2}|2[0-4][0-9]|25[0-5])\\.){3}(?:[0-9]|[1-9][0-9]|1[0-9]{2}|2[0-4][0-9]|25[0-5]))|(?:[0-9A-Fa-f]{1,4}(?::[0-9A-Fa-f]{1,4}){0,2})?::(?:[0-9A-Fa-f]{1,4}:){2}(?:[0-9A-Fa-f]{1,4}:[0-9A-Fa-f]{1,4}|(?:(?:[0-9]|[1-9][0-9]|1[0-9]{2}|2[0-4][0-9]|25[0-5])\\.){3}(?:[0-9]|[1-9][0-9]|1[0-9]{2}|2[0-4][0-9]|25[0-5]))|(?:[0-9A-Fa-f]{1,4}(?::[0-9A-Fa-f]{1,4}){0,3})?::[0-9A-Fa-f]{1,4}:(?:[0-9A-Fa-f]{1,4}:[0-9A-Fa-f]{1,4}|(?:(?:[0-9]|[1-9][0-9]|1[0-9]{2}|2[0-4][0-9]|25[0-5])\\.){3}(?:[0-9]|[1-9][0-9]|1[0-9]{2}|2[0-4][0-9]|25[0-5]))|(?:[0-9A-Fa-f]{1,4}(?::[0-9A-Fa-f]{1,4}){0,4})?::(?:[0-9A-Fa-f]{1,4}:[0-9A-Fa-f]{1,4}|(?:(?:[0-9]|[1-9][0-9]|1[0-9]{2}|2[0-4][0-9]|25[0-5])\\.){3}(?:[0-9]|[1-9][0-9]|1[0-9]{2}|2[0-4][0-9]|25[0-5]))|(?:[0-9A-Fa-f]{1,4}(?::[0-9A-Fa-f]{1,4}){0,5})?::[0-9A-Fa-f]{1,4}|(?:[0-9A-Fa-f]{1,4}(?::[0-9A-Fa-f]{1,4}){0,6})?::)|v[0-9A-Fa-f]+\\.(?:[A-Za-z0-9._~-]|[!$&'()*+,;=]|:)+)\\]|(?:(?:[0-9]|[1-9][0-9]|1[0-9]{2}|2[0-4][0-9]|25[0-5])\\.){3}(?:[0-9]|[1-9][0-9]|1[0-9]{2}|2[0-4][0-9]|25[0-5])|(?:[A-Za-z0-9._~-]|%[0-9A-Fa-f]{2}|[!$&'()*+,;=])*)(?::[0-9]*)?(?:/(?:[A-Za-z0-9._~-]|%[0-9A-Fa-f]{2}|[!$&'()*+,;=]|[:@])*)*|/(?:(?:[A-Za-z0-9._~-]|%[0-9A-Fa-f]{2}|[!$&'()*+,;=]|[:@])+(?:/(?:[A-Za-z0-9._~-]|%[0-9A-Fa-f]{2}|[!$&'()*+,;=]|[:@])*)*)?|(?:[A-Za-z0-9._~-]|%[0-9A-Fa-f]{2}|[!$&'()*+,;=]|[:@])+(?:/(?:[A-Za-z0-9._~-]|%[0-9A-Fa-f]{2}|[!$&'()*+,;=]|[:@])*)*|)(?:\\?(?:(?:[A-Za-z0-9._~-]|%[0-9A-Fa-f]{2}|[!$&'()*+,;=]|[:@])|[/?])*)?(?:#(?:(?:[A-Za-z0-9._~-]|%[0-9A-Fa-f]{2}|[!$&'()*+,;=]|[:@])|[/?])*)?|(?://(?:(?:[A-Za-z0-9._~-]|%[0-9A-Fa-f]{2}|[!$&'()*+,;=]|:)*@)?(?:\\[(?:(?:(?:[0-9A-Fa-f]{1,4}:){6}(?:[0-9A-Fa-f]{1,4}:[0-9A-Fa-f]{1,4}|(?:(?:[0-9]|[1-9][0-9]|1[0-9]{2}|2[0-4][0-9]|25[0-5])\\.){3}(?:[0-9]|[1-9][0-9]|1[0-9]{2}|2[0-4][0-9]|25[0-5]))|::(?:[0-9A-Fa-f]{1,4}:){5}(?:[0-9A-Fa-f]{1,4}:[0-9A-Fa-f]{1,4}|(?:(?:[0-9]|[1-9][0-9]|1[0-9]{2}|2[0-4][0-9]|25[0-5])\\.){3}(?:[0-9]|[1-9][0-9]|1[0-9]{2}|2[0-4][0-9]|25[0-5]))|(?:[0-9A-Fa-f]{1,4})?::(?:[0-9A-Fa-f]{1,4}:){4}(?:[0-9A-Fa-f]{1,4}:[0-9A-Fa-f]{1,4}|(?:(?:[0-9]|[1-9][0-9]|1[0-9]{2}|2[0-4][0-9]|25[0-5])\\.){3}(?:[0-9]|[1-9][0-9]|1[0-9]{2}|2[0-4][0-9]|25[0-5]))|(?:[0-9A-Fa-f]{1,4}(?::[0-9A-Fa-f]{1,4}){0,1})?::(?:[0-9A-Fa-f]{1,4}:){3}(?:[0-9A-Fa-f]{1,4}:[0-9A-Fa-f]{1,4}|(?:(?:[0-9]|[1-9][0-9]|1[0-9]{2}|2[0-4][0-9]|25[0-5])\\.){3}(?:[0-9]|[1-9][0-9]|1[0-9]{2}|2[0-4][0-9]|25[0-5]))|(?:[0-9A-Fa-f]{1,4}(?::[0-9A-Fa-f]{1,4}){0,2})?::(?:[0-9A-Fa-f]{1,4}:){2}(?:[0-9A-Fa-f]{1,4}:[0-9A-Fa-f]{1,4}|(?:(?:[0-9]|[1-9][0-9]|1[0-9]{2}|2[0-4][0-9]|25[0-5])\\.){3}(?:[0-9]|[1-9][0-9]|1[0-9]{2}|2[0-4][0-9]|25[0-5]))|(?:[0-9A-Fa-f]{1,4}(?::[0-9A-Fa-f]{1,4}){0,3})?::[0-9A-Fa-f]{1,4}:(?:[0-9A-Fa-f]{1,4}:[0-9A-Fa-f]{1,4}|(?:(?:[0-9]|[1-9][0-9]|1[0-9]{2}|2[0-4][0-9]|25[0-5])\\.){3}(?:[0-9]|[1-9][0-9]|1[0-9]{2}|2[0-4][0-9]|25[0-5]))|(?:[0-9A-Fa-f]{1,4}(?::[0-9A-Fa-f]{1,4}){0,4})?::(?:[0-9A-Fa-f]{1,4}:[0-9A-Fa-f]{1,4}|(?:(?:[0-9]|[1-9][0-9]|1[0-9]{2}|2[0-4][0-9]|25[0-5])\\.){3}(?:[0-9]|[1-9][0-9]|1[0-9]{2}|2[0-4][0-9]|25[0-5]))|(?:[0-9A-Fa-f]{1,4}(?::[0-9A-Fa-f]{1,4}){0,5})?::[0-9A-Fa-f]{1,4}|(?:[0-9A-Fa-f]{1,4}(?::[0-9A-Fa-f]{1,4}){0,6})?::)|v[0-9A-Fa-f]+\\.(?:[A-Za-z0-9._~-]|[!$&'()*+,;=]|:)+)\\]|(?:(?:[0-9]|[1-9][0-9]|1[0-9]{2}|2[0-4][0-9]|25[0-5])\\.){3}(?:[0-9]|[1-9][0-9]|1[0-9]{2}|2[0-4][0-9]|25[0-5])|(?:[A-Za-z0-9._~-]|%[0-9A-Fa-f]{2}|[!$&'()*+,;=])*)(?::[0-9]*)?(?:/(?:[A-Za-z0-9._~-]|%[0-9A-Fa-f]{2}|[!$&'()*+,;=]|[:@])*)*|/(?:(?:[A-Za-z0-9._~-]|%[0-9A-Fa-f]{2}|[!$&'()*+,;=]|[:@])+(?:/(?:[A-Za-z0-9._~-]|%[0-9A-Fa-f]{2}|[!$&'()*+,;=]|[:@])*)*)?|(?:[A-Za-z0-9._~-]|%[0-9A-Fa-f]{2}|[!$&'()*+,;=]|@)+(?:/(?:[A-Za-z0-9._~-]|%[0-9A-Fa-f]{2}|[!$&'()*+,;=]|[:@])*)*|)(?:\\?(?:(?:[A-Za-z0-9._~-]|%[0-9A-Fa-f]{2}|[!$&'()*+,;=]|[:@])|[/?])*)?(?:#(?:(?:[A-Za-z0-9._~-]|%[0-9A-Fa-f]{2}|[!$&'()*+,;=]|[:@])|[/?])*)?)$",
      "title": "Source",
      "type": "string"
    },
    "streamid": {
      "maxLength": 128,
      "minLength": 1,
      "pattern": "^[A-Za-z0-9][A-Za-z0-9._:-]*$",
      "title": "Streamid",
      "type": "string"
    },
    "subject": {
      "minLength": 1,
      "pattern": "^[^\\x00-\\x1F\\x7F-\\x9F]+$",
      "title": "Subject",
      "type": "string"
    },
    "workflowId": {
      "maxLength": 128,
      "minLength": 1,
      "pattern": "^[A-Za-z0-9][A-Za-z0-9._:-]*$",
      "title": "Workflowid",
      "type": "string"
    }
  },
  "required": [
    "apiVersion",
    "kind",
    "runId",
    "workflowId",
    "attemptId",
    "source",
    "subject",
    "streamid",
    "actor",
    "events"
  ],
  "title": "SimulationRequestDocument",
  "type": "object"
}
